{
  "$schema": "https://json-schema.org/draft/2020-12/schema",
  "$id": "https://cantre.invalid/schema/manifest.schema.json",
  "title": "CANTRE manifest (cantre.manifest/1)",
  "description": "Build manifest: versions, configuration, sources, per-province totals (km, counts) and per-tile hashes and sizes (bytes). A national build (python -m cantre_pipeline national) also sets snapshot, assetDetails and snapshotDate, and lists no tiles: the tiles are built and size-checked but only the two data files are deployed.",
  "type": "object",
  "properties": {
    "schema": {
      "const": "cantre.manifest/1"
    },
    "datasetVersion": {
      "type": "string"
    },
    "pipelineVersion": {
      "type": "string"
    },
    "attribution": {
      "type": "string"
    },
    "config": {
      "type": "object"
    },
    "configSha256": {
      "type": "string",
      "pattern": "^[0-9a-f]{64}$"
    },
    "sources": {
      "type": "array",
      "items": {
        "type": "object",
        "properties": {
          "sourceId": {
            "type": "string"
          },
          "kind": {
            "enum": [
              "zip",
              "file"
            ]
          },
          "url": {
            "type": "string"
          },
          "publisher": {
            "type": "string"
          },
          "catalogueUrl": {
            "type": "string"
          },
          "licenceName": {
            "type": "string"
          },
          "licenceUrl": {
            "type": "string"
          },
          "httpLastModified": {
            "type": [
              "string",
              "null"
            ]
          },
          "contentLength": {
            "type": "integer",
            "minimum": 0
          },
          "sha256": {
            "type": "string",
            "pattern": "^[0-9a-f]{64}$"
          },
          "retrievedUtc": {
            "type": "string"
          },
          "packageVersion": {
            "type": "string"
          },
          "crsWkt": {
            "type": [
              "string",
              "null"
            ]
          },
          "metadataMember": {
            "type": [
              "string",
              "null"
            ]
          },
          "members": {
            "type": "array",
            "items": {
              "type": "object",
              "properties": {
                "name": {
                  "type": "string"
                },
                "size": {
                  "type": "integer",
                  "minimum": 0
                },
                "sha256": {
                  "type": "string",
                  "pattern": "^[0-9a-f]{64}$"
                }
              },
              "required": [
                "name",
                "size",
                "sha256"
              ],
              "additionalProperties": false
            }
          }
        },
        "required": [
          "sourceId",
          "kind",
          "url",
          "publisher",
          "catalogueUrl",
          "licenceName",
          "licenceUrl",
          "httpLastModified",
          "contentLength",
          "sha256",
          "retrievedUtc",
          "packageVersion",
          "crsWkt",
          "metadataMember",
          "members"
        ],
        "additionalProperties": false
      }
    },
    "provinces": {
      "type": "object",
      "additionalProperties": {
        "type": "object",
        "properties": {
          "packageVersion": {
            "type": "string",
            "description": "NRWN package version of this province, e.g. 2.0"
          },
          "chainKm": {
            "type": "number",
            "minimum": 0
          },
          "calibratedKm": {
            "type": "number",
            "minimum": 0
          },
          "calibratedKmPostedOnly": {
            "type": "number",
            "minimum": 0
          },
          "anchorsByTier": {
            "type": "object",
            "additionalProperties": {
              "type": "integer",
              "minimum": 0
            }
          },
          "isolatedAnchors": {
            "type": "integer",
            "minimum": 0
          },
          "assetsByKind": {
            "type": "object",
            "additionalProperties": {
              "type": "integer",
              "minimum": 0
            }
          },
          "tiles": {
            "type": "array",
            "items": {
              "type": "string"
            }
          }
        },
        "required": [
          "packageVersion",
          "chainKm",
          "calibratedKm",
          "calibratedKmPostedOnly",
          "anchorsByTier",
          "isolatedAnchors",
          "assetsByKind",
          "tiles"
        ],
        "additionalProperties": false
      }
    },
    "tiles": {
      "type": "array",
      "items": {
        "type": "object",
        "properties": {
          "key": {
            "type": "string",
            "pattern": "^-?[0-9]+_-?[0-9]+$"
          },
          "path": {
            "type": "string"
          },
          "sha256": {
            "type": "string",
            "pattern": "^[0-9a-f]{64}$"
          },
          "bytes": {
            "type": "integer",
            "minimum": 0
          },
          "gzipBytes": {
            "type": "integer",
            "minimum": 0
          },
          "bounds": {
            "$ref": "#/$defs/bounds"
          },
          "provinces": {
            "type": "array",
            "items": {
              "type": "string"
            },
            "minItems": 1
          }
        },
        "required": [
          "key",
          "path",
          "sha256",
          "bytes",
          "gzipBytes",
          "bounds",
          "provinces"
        ],
        "additionalProperties": false
      }
    },
    "snapshot": {
      "$ref": "#/$defs/fileRef",
      "description": "The national snapshot (layout: schema/snapshot.md). Present only in a national manifest."
    },
    "snapshotFormat": {
      "type": "integer",
      "minimum": 1,
      "description": "The snapshot's byte-layout version (the format byte after the magic, schema/snapshot.md). A client that does not support it must refuse the build before downloading anything. Present only in a national manifest."
    },
    "assetDetails": {
      "$ref": "#/$defs/fileRef",
      "description": "Asset details (layer and attributes by asset id), downloaded together with the snapshot. Present only in a national manifest."
    },
    "snapshotDate": {
      "type": "string",
      "pattern": "^[0-9]{4}-[0-9]{2}-[0-9]{2}$",
      "description": "UTC date (YYYY-MM-DD) of the latest source retrieval the snapshot used, or the date given to the build; never the wall clock. Present only in a national manifest."
    }
  },
  "required": [
    "schema",
    "datasetVersion",
    "pipelineVersion",
    "attribution",
    "config",
    "configSha256",
    "sources",
    "provinces",
    "tiles"
  ],
  "additionalProperties": false,
  "$defs": {
    "bounds": {
      "type": "object",
      "properties": {
        "south": {
          "type": "number"
        },
        "west": {
          "type": "number"
        },
        "north": {
          "type": "number"
        },
        "east": {
          "type": "number"
        }
      },
      "required": [
        "south",
        "west",
        "north",
        "east"
      ],
      "additionalProperties": false
    },
    "fileRef": {
      "type": "object",
      "description": "A published file. sha256 is the SHA-256 of the file at path exactly as served (the gzip bytes), so a client can check it before decoding. bytes is the size of the decompressed content; gzipBytes is the size of the file at path.",
      "properties": {
        "path": {
          "type": "string",
          "description": "File name, relative to the manifest."
        },
        "sha256": {
          "type": "string",
          "pattern": "^[0-9a-f]{64}$"
        },
        "bytes": {
          "type": "integer",
          "minimum": 0
        },
        "gzipBytes": {
          "type": "integer",
          "minimum": 0
        }
      },
      "required": [
        "path",
        "sha256",
        "bytes",
        "gzipBytes"
      ],
      "additionalProperties": false
    }
  }
}
