{
  "assetDetails": {
    "bytes": 2927,
    "gzipBytes": 384,
    "path": "nrwn-national-249bfc97-cantre.0.1.0/asset-details.json.gz",
    "sha256": "35e56200cfe241cfefae39a598ae2796756ddfa29a46a727fb6cb71f08a10533"
  },
  "attribution": "Contains information licensed under the Open Government Licence – Canada.",
  "config": {
    "anchor_collapse_span_m": 30.0,
    "anchor_max_residual_m": 25.0,
    "coord_scale": 1000000,
    "mp_equal_tol_mi": 0.005,
    "posting_step_mi": 0.01,
    "s_scale": 1000,
    "slope_min_span_m": 800.0,
    "slope_tolerance": 0.15,
    "snap_deg": 1e-7,
    "tc_max_disagreement_mi": 0.05,
    "tile_budget_gzip_bytes": 500000,
    "tile_buffer_m": 2000.0,
    "tile_lat_deg": 0.25,
    "tile_lon_deg": 0.5,
    "unverified_max_deviation_mi": 0.05
  },
  "configSha256": "eec00a0301149b4367d386562b2c5f531cb4491111899a90752acc507542ab7f",
  "datasetVersion": "nrwn-national-249bfc97+cantre.0.1.0",
  "pipelineVersion": "0.1.0",
  "provinces": {
    "ab": {
      "anchorsByTier": { "posted": 2, "tc": 0, "unverified": 1 },
      "assetsByKind": { "crossing": 2, "culvert": 1, "station": 1 },
      "calibratedKm": 4.111493,
      "calibratedKmPostedOnly": 4.111493,
      "chainKm": 6.852488,
      "isolatedAnchors": 0,
      "packageVersion": "synthetic-ab",
      "tiles": ["208_-212"]
    },
    "sk": {
      "anchorsByTier": { "posted": 34, "tc": 3, "unverified": 3 },
      "assetsByKind": { "bridge": 1, "crossing": 48, "culvert": 1, "diamond": 1, "station": 2 },
      "calibratedKm": 59.052431,
      "calibratedKmPostedOnly": 57.485057,
      "chainKm": 93.11367,
      "isolatedAnchors": 3,
      "packageVersion": "synthetic",
      "tiles": [
        "208_-212",
        "208_-213",
        "209_-212",
        "209_-213",
        "210_-212",
        "210_-213",
        "211_-212",
        "211_-213",
        "212_-212",
        "212_-213",
        "213_-212",
        "213_-213",
        "214_-212",
        "214_-213",
        "215_-212",
        "215_-213",
        "216_-212",
        "216_-213"
      ]
    }
  },
  "schema": "cantre.manifest/1",
  "snapshot": {
    "bytes": 14721,
    "gzipBytes": 3396,
    "path": "nrwn-national-249bfc97-cantre.0.1.0/snapshot.bin.gz",
    "sha256": "7330747acb3d98edd9ea9ab4945e94a835e36427ef6c639d93b3441d7230d418"
  },
  "snapshotDate": "2026-01-02",
  "sources": [
    {
      "catalogueUrl": "synthetic://nrwn-ab",
      "contentLength": 0,
      "crsWkt": null,
      "httpLastModified": null,
      "kind": "zip",
      "licenceName": "none (invented data)",
      "licenceUrl": "synthetic://none",
      "members": [],
      "metadataMember": null,
      "packageVersion": "synthetic-ab",
      "publisher": "synthetic",
      "retrievedUtc": "2026-01-02T00:00:00Z",
      "sha256": "3333333333333333333333333333333333333333333333333333333333333333",
      "sourceId": "ab",
      "url": "synthetic://nrwn-ab"
    },
    {
      "catalogueUrl": "synthetic://nrwn-sk",
      "contentLength": 0,
      "crsWkt": null,
      "httpLastModified": null,
      "kind": "zip",
      "licenceName": "none (invented data)",
      "licenceUrl": "synthetic://none",
      "members": [],
      "metadataMember": null,
      "packageVersion": "synthetic",
      "publisher": "synthetic",
      "retrievedUtc": "2026-01-01T00:00:00Z",
      "sha256": "0000000000000000000000000000000000000000000000000000000000000000",
      "sourceId": "sk",
      "url": "synthetic://nrwn-sk"
    },
    {
      "catalogueUrl": "synthetic://tc-gci",
      "contentLength": 0,
      "crsWkt": null,
      "httpLastModified": null,
      "kind": "file",
      "licenceName": "none (invented data)",
      "licenceUrl": "synthetic://none",
      "members": [],
      "metadataMember": null,
      "packageVersion": "synthetic",
      "publisher": "synthetic",
      "retrievedUtc": "2026-01-01T00:00:00Z",
      "sha256": "1111111111111111111111111111111111111111111111111111111111111111",
      "sourceId": "tc-gci",
      "url": "synthetic://tc-gci"
    }
  ],
  "tiles": []
}
